{
  "clientName": "⭐-lone-star",
  "context": [
    "Client is experiencing issues with Google Calendar integration and Facebook Ads Manager access.",
    "Payment issues with declined transactions on specific cards; client prefers not to use card ending in 8860."
  ],
  "status": "The client is facing technical issues with calendar integration and ads manager access, and there are unresolved payment issues with declined transactions. A screen-share session was planned to resolve these issues, but it seems there was a missed connection for the scheduled call.",
  "next": "Davi → Follow up with the client to reschedule the screen-share session to resolve the calendar and ads manager issues, and confirm the payment method to use.",
  "teamChatter": null,
  "risk": "Potential risk of dissatisfaction due to unresolved technical and payment issues.",
  "urgencyScore": 0,
  "needsManualReview": false,
  "reviewNote": null
}