{
  "clientName": "🅱️-braymiller-builders",
  "context": [
    "The current ads are generating leads at a lower cost than previous campaigns.",
    "The client is experiencing issues converting these leads into appointments or sales."
  ],
  "status": "The client is seeing good performance from the ads in terms of cost per lead, but there is a disconnect in converting these leads into actual sales or appointments. The client is open to discussing their follow-up process to identify potential issues.",
  "next": "Max → Schedule a call with Mike to discuss and review the lead follow-up process via screen sharing.",
  "teamChatter": null,
  "risk": null,
  "urgencyScore": 1,
  "needsManualReview": false,
  "reviewNote": null
}