{
  "clientName": "🍂-four-seasons-design-build",
  "context": [
    "Kenneth had login issues with the CRM and a bank issue with Meta charges, both resolved.",
    "Leads are now coming through, but Kenneth needs a call to discuss important matters."
  ],
  "status": "Kenneth has resolved the login and bank issues, and the campaign is running with leads coming in. He has requested a call with Max to discuss important matters that are easier to handle over the phone.",
  "next": "Max → Call Kenneth to discuss his important questions and ensure he is comfortable with the lead process.",
  "teamChatter": null,
  "risk": null,
  "urgencyScore": 2,
  "needsManualReview": false,
  "reviewNote": null
}