{
  "clientName": "🐝-be-decking-and-construction",
  "context": [
    "Client expressed hope that good weather will boost interest in outdoor projects."
  ],
  "status": "The client is optimistic about the impact of current weather conditions on potential customer interest in their services.",
  "next": "Davi → Check in with the client next week to see if there has been an increase in inquiries or interest due to the weather.",
  "teamChatter": null,
  "risk": null,
  "urgencyScore": 3,
  "needsManualReview": false,
  "reviewNote": null
}