{
  "clientName": "🤖-mibh-construction",
  "context": [
    "The client has launched and needs assistance with GoHighLevel access and setup.",
    "Ads were paused to finalize automation but are now live again."
  ],
  "status": "Moshe Baruh is seeking leads and requested a Zoom call for further assistance. Max Hastings confirmed that ads are live again after a brief pause to finalize automation.",
  "next": "Max → Schedule a Zoom call with Moshe to address his questions and ensure he is receiving leads as expected.",
  "teamChatter": null,
  "risk": null,
  "urgencyScore": 1,
  "needsManualReview": false,
  "reviewNote": null
}