{
  "clientName": "🍷-jj-remodeling",
  "context": [
    "Ads are scripted and expected to launch by the end of the week.",
    "Client is preparing to start receiving lead calls."
  ],
  "status": "The ad campaign is in the final preparation stages and is expected to launch soon. The client is being prepared for lead calls and app usage.",
  "next": "Max → Notify Jesus when the ads are launched and provide guidance on app usage and lead handling.",
  "teamChatter": null,
  "risk": null,
  "urgencyScore": 2,
  "needsManualReview": false,
  "reviewNote": null
}